{
  "template_id": "TPL-family-animation",
  "extends": null,
  "director": {
    "pace": {
      "avg_shot_s": 4.5,
      "range": [
        3.5,
        6
      ]
    },
    "still_video_ratio": 0.45,
    "motion_ceiling": 3,
    "silence_per_act": 1,
    "beat_weight_cap": 0.85,
    "camera_vocabulary": [
      "static",
      "push_in.slow",
      "pull_out.slow",
      "pan.left",
      "pan.right",
      "tilt.up",
      "tilt.down"
    ]
  },
  "visual": {
    "style_profile_ref": "style/family_animation.json",
    "palette": {
      "dominant": [
        "bright",
        "high-key",
        "rounded forms"
      ],
      "forbidden": [
        "crushed blacks"
      ]
    },
    "lens_set": [
      "wide",
      "normal",
      "portrait"
    ],
    "lighting": [
      "golden_hour",
      "single_window_soft",
      "studio_neutral"
    ],
    "forbidden": [
      "gore",
      "dread lighting"
    ]
  },
  "audio": {
    "narrator": {
      "stability": 0.55,
      "style": 0.35,
      "speed": 1.0,
      "wpm": 135
    },
    "music": {
      "density": "high",
      "instruments": "orchestral, thematic motif",
      "loudness_under_speech_db": -20
    },
    "ambience": "warm and lively",
    "silence_max_s": 1.5
  },
  "qa_overrides": {
    "audience_rating": "general"
  },
  "budget_profile": {
    "credits_per_minute": 230
  }
}
